{
  "run_id": "20261022-012201",
  "timestamp": "2026-10-22T01:22:01",
  "nichos_objetivo": [
    "mecanica",
    "clinica",
    "ingenieria"
  ],
  "nichos_procesados": [
    "clinica",
    "ingenieria",
    "mecanica"
  ],
  "total_prospectos": 46,
  "prospectos": [
    {
      "nombre": "Obicon Automobile Technologies C.A. (Obicon Auto)",
      "nicho": "mecanica",
      "telefono": "+58 261 7411701",
      "web": "Sin Web",
      "url": "",
      "email": "",
      "contacto": "Dominio obicon.com.ve registrado pero caído (no resuelve)",
      "tipo_contacto": "directo",
      "fuente": "https://www.yellowpages.com.ve/phone-58-2617411701-taller-de-reparaci%C3%B3n-de-autom%C3%B3viles-Maracaibo-VEEN19891.html",
      "estado_contacto": "pendiente",
      "fecha_envio": ""
    },
    {
      "nombre": "Multiservicios y Trípodes Eberth C.A.",
      "nicho": "mecanica",
      "telefono": "+58 261 7834813",
      "web": "Sin Web",
      "url": "",
      "email": "",
      "contacto": "",
      "tipo_contacto": "directo",
      "fuente": "https://todainfo.com/directorio/multiservicios-y-tripoides-eberth/",
      "estado_contacto": "pendiente",
      "fecha_envio": ""
    },
    {
      "nombre": "Autoservicio Múltiple Cándido P.C.",
      "nicho": "mecanica",
      "telefono": "+58 261 3643385",
      "web": "Sin Web",
      "url": "",
      "email": "",
      "contacto": "",
      "tipo_contacto": "directo",
      "fuente": "https://www.amerpages.com/ve/autoservicio-multiple-candido-pc-maracaibo",
      "estado_contacto": "pendiente",
      "fecha_envio": ""
    },
    {
      "nombre": "Cenaucas, C.A.",
      "nicho": "mecanica",
      "telefono": "+58 261 7830916",
      "web": "Sin Web",
      "url": "",
      "email": "",
      "contacto": "",
      "tipo_contacto": "directo",
      "fuente": "https://www.amerpages.com/ve/cenaucas-c-a-maracaibo",
      "estado_contacto": "pendiente",
      "fecha_envio": ""
    },
    {
      "nombre": "Contratista T & M Servicios, C.A.",
      "nicho": "mecanica",
      "telefono": "+58 261 7357235",
      "web": "Sin Web",
      "url": "",
      "email": "",
      "contacto": "",
      "tipo_contacto": "directo",
      "fuente": "https://www.amerpages.com/ve/contratista-t-y-m-servicios-c-a-maracaibo",
      "estado_contacto": "pendiente",
      "fecha_envio": ""
    },
    {
      "nombre": "Cauchos El Triángulo",
      "nicho": "mecanica",
      "telefono": "+58 414 3649616",
      "web": "Sin Web",
      "url": "",
      "email": "",
      "contacto": "",
      "tipo_contacto": "directo",
      "fuente": "https://www.amerpages.com/ve/cauchos-el-triangulo-maracaibo",
      "estado_contacto": "pendiente",
      "fecha_envio": ""
    },
    {
      "nombre": "Taller Automotriz D & M, C.A.",
      "nicho": "mecanica",
      "telefono": "+58 414 3320713",
      "web": "Sin Web",
      "url": "",
      "email": "",
      "contacto": "",
      "tipo_contacto": "directo",
      "fuente": "http://pymesvenezuela.com/ficha/taller-automotriz-d-m-ca-127138",
      "estado_contacto": "pendiente",
      "fecha_envio": ""
    },
    {
      "nombre": "Taller de Latonería y Pintura Car-Master C.A.",
      "nicho": "mecanica",
      "telefono": "+58 414 6125768",
      "web": "Sin Web",
      "url": "",
      "email": "",
      "contacto": "",
      "tipo_contacto": "directo",
      "fuente": "http://pymesvenezuela.com/ficha/taller-de-latoneria-y-pintura-car-master-ca-58876",
      "estado_contacto": "pendiente",
      "fecha_envio": ""
    },
    {
      "nombre": "Talleres Pacho, C.A.",
      "nicho": "mecanica",
      "telefono": "+58 414 6025201",
      "web": "Sin Web",
      "url": "",
      "email": "gunthereichner@hotmail.com",
      "contacto": "Alt: +58 426 4688903",
      "tipo_contacto": "directo",
      "fuente": "https://www.aiyellow.com/gunthereichner/",
      "estado_contacto": "pendiente",
      "fecha_envio": ""
    },
    {
      "nombre": "Frenos y Repuestos Saulito, C.A.",
      "nicho": "mecanica",
      "telefono": "+58 414 6801605",
      "web": "Sin Web",
      "url": "",
      "email": "elisaul56@hotmail.com",
      "contacto": "",
      "tipo_contacto": "directo",
      "fuente": "https://www.aiyellow.com/frenosyrepuestosaulito/",
      "estado_contacto": "pendiente",
      "fecha_envio": ""
    },
    {
      "nombre": "Tripoides Lino, C.A.",
      "nicho": "mecanica",
      "telefono": "+58 414 3637672",
      "web": "Sin Web",
      "url": "",
      "email": "tripoideslino@hotmail.com",
      "contacto": "",
      "tipo_contacto": "directo",
      "fuente": "https://www.aiyellow.com/tripoideslino/",
      "estado_contacto": "pendiente",
      "fecha_envio": ""
    },
    {
      "nombre": "Cauchos y Tripoides La 13",
      "nicho": "mecanica",
      "telefono": "+58 414 6302647",
      "web": "Con Web",
      "url": "http://www.grupola13.amawebs.com",
      "email": "cauchosla13@gmail.com",
      "contacto": "",
      "tipo_contacto": "directo",
      "fuente": "https://www.aiyellow.com/cauchosla13/",
      "estado_contacto": "pendiente",
      "fecha_envio": ""
    },
    {
      "nombre": "Sensei Motors, C.A.",
      "nicho": "mecanica",
      "telefono": "+58 414 6279550",
      "web": "Sin Web",
      "url": "",
      "email": "senseimotors@hotmail.com",
      "contacto": "",
      "tipo_contacto": "directo",
      "fuente": "https://www.aiyellow.com/senseimotors/",
      "estado_contacto": "pendiente",
      "fecha_envio": ""
    },
    {
      "nombre": "Servicios Automotriz R&G, C.A.",
      "nicho": "mecanica",
      "telefono": "+58 261 7973613",
      "web": "Sin Web",
      "url": "",
      "email": "serviciosautomotrizrg@gmail.com",
      "contacto": "",
      "tipo_contacto": "directo",
      "fuente": "https://www.editores.laofertaylademanda.com/Venezuela/view?customer_id=12828&page=3",
      "estado_contacto": "pendiente",
      "fecha_envio": ""
    },
    {
      "nombre": "Taller Recamar, C.A.",
      "nicho": "mecanica",
      "telefono": "+58 414 6350124",
      "web": "Sin Web",
      "url": "",
      "email": "recamar_1@hotmail.com",
      "contacto": "",
      "tipo_contacto": "directo",
      "fuente": "http://pymesvenezuela.com/ficha/taller-recamar-ca-84659",
      "estado_contacto": "pendiente",
      "fecha_envio": ""
    },
    {
      "nombre": "Mara Service, C.A.",
      "nicho": "mecanica",
      "telefono": "+58 424 6792315",
      "web": "Sin Web",
      "url": "",
      "email": "maraservice_ca@hotmail.com",
      "contacto": "",
      "tipo_contacto": "directo",
      "fuente": "https://www.editores.laofertaylademanda.com/Venezuela/view?customer_id=14720&page=9",
      "estado_contacto": "pendiente",
      "fecha_envio": ""
    },
    {
      "nombre": "Centro Médico Docente Paraíso",
      "nicho": "clinica",
      "telefono": "+58 261 7401411",
      "web": "Con Web",
      "url": "https://clinicaparaiso.com.ve/",
      "email": "",
      "contacto": "Respaldo: 0261-7004650 / 0261-7000100",
      "tipo_contacto": "directo",
      "fuente": "https://clinicaparaiso.com.ve/contactos/",
      "estado_contacto": "pendiente",
      "fecha_envio": ""
    },
    {
      "nombre": "Clínica Sierra Maestra C.A.",
      "nicho": "clinica",
      "telefono": "+58 261 7350414",
      "web": "Sin Web",
      "url": "",
      "email": "",
      "contacto": "",
      "tipo_contacto": "directo",
      "fuente": "https://todainfo.com/directorio/clinica-sierra-maestra-c-a/",
      "estado_contacto": "pendiente",
      "fecha_envio": ""
    },
    {
      "nombre": "Policlínica San Francisco C.A.",
      "nicho": "clinica",
      "telefono": "+58 261 7630211",
      "web": "Sin Web",
      "url": "",
      "email": "",
      "contacto": "",
      "tipo_contacto": "directo",
      "fuente": "https://todainfo.com/directorio/policlinica-san-francisco-c-a/",
      "estado_contacto": "pendiente",
      "fecha_envio": ""
    },
    {
      "nombre": "Centro Médico Integral IZOT",
      "nicho": "clinica",
      "telefono": "+58 414 6385869",
      "web": "Sin Web",
      "url": "",
      "email": "",
      "contacto": "",
      "tipo_contacto": "directo",
      "fuente": "https://firmania.com.ve/maracaibo-zulia/centro-medico-integral-izot-3199",
      "estado_contacto": "pendiente",
      "fecha_envio": ""
    },
    {
      "nombre": "Clínica Tendencia Body",
      "nicho": "clinica",
      "telefono": "+58 416 5037131",
      "web": "Sin Web",
      "url": "",
      "email": "",
      "contacto": "",
      "tipo_contacto": "directo",
      "fuente": "https://todainfo.com/directorio/clinica-tendencia-body/",
      "estado_contacto": "pendiente",
      "fecha_envio": ""
    },
    {
      "nombre": "Hogar Clínica San Rafael",
      "nicho": "clinica",
      "telefono": "+58 424 6664733",
      "web": "Con Web",
      "url": "https://hogarmaracaibo.sanjuandedios.com.ve/",
      "email": "",
      "contacto": "",
      "tipo_contacto": "directo",
      "fuente": "https://hogarmaracaibo.sanjuandedios.com.ve/",
      "estado_contacto": "pendiente",
      "fecha_envio": ""
    },
    {
      "nombre": "Centro Médico Madre Rafols, C.A.",
      "nicho": "clinica",
      "telefono": "+58 261 7544354",
      "web": "Con Web",
      "url": "https://ssmadrerafols.org/",
      "email": "",
      "contacto": "",
      "tipo_contacto": "directo",
      "fuente": "https://www.venezuelayello.com/category/M%C3%A9dicos_y_Cl%C3%ADnicos/city:Maracaibo",
      "estado_contacto": "pendiente",
      "fecha_envio": ""
    },
    {
      "nombre": "Clínica Falcón",
      "nicho": "clinica",
      "telefono": "+58 261 7974922",
      "web": "Sin Web",
      "url": "",
      "email": "",
      "contacto": "",
      "tipo_contacto": "directo",
      "fuente": "https://www.venezuelayello.com/category/M%C3%A9dicos_y_Cl%C3%ADnicos/city:Maracaibo",
      "estado_contacto": "pendiente",
      "fecha_envio": ""
    },
    {
      "nombre": "Centro Médico de Occidente",